{
  "effective_execution_limits": {
    "attempts_per_image": 3,
    "automatic_daily_reset": false,
    "batch_request_wait_seconds": 900,
    "daily_request_headroom": 1,
    "input_reservation": 4096,
    "input_window_seconds": 60,
    "maximum_run_submissions": 345,
    "minimum_start_interval_seconds": 10,
    "quota_start_spacing": "max(10 seconds, 120 / verified RPM), plus shared rolling input-token reservation",
    "request_timeout_seconds": 60,
    "shared_gemma_allowance": true,
    "shared_trial_evaluation_allowance": true,
    "submissions_per_batch": 12
  },
  "frozen_plan": {
    "configuration": {
      "max_output_tokens": 2048,
      "max_requests_per_model": 345,
      "max_runtime_seconds": 600,
      "minimum_interval_seconds": 10,
      "model_ids": [
        "gemma-4-26b-a4b-it",
        "gemma-4-31b-it"
      ],
      "probe_count": 2,
      "prompt": "Inspect the candidate metal nut image against the acceptable reference image. Decide looks_acceptable, needs_review, or uncertain based only on visible appearance. Use uncertain when detail is insufficient. Give one concise observation about visible evidence. Do not infer root cause, severity, defect probability, or factory acceptance. The reference is a normal public-dataset example; it is not a validated factory standard. Return only the requested JSON object.",
      "purpose": "normal_preparation_trial_not_defect_evaluation",
      "reference_count": 1,
      "reserved_input_tokens_per_request": 4096,
      "schema_version": 1,
      "thinking_level": "minimal"
    },
    "execution_policy": {
      "automatic_daily_reset": false,
      "batch_request_wait_seconds": 900,
      "daily_request_headroom": 1,
      "input_reservation": 4096,
      "input_window_seconds": 60,
      "minimum_interval_seconds": 10,
      "shared_gemma_allowance": true,
      "submissions_per_batch": 12
    },
    "frozen_at": "2026-10-25T13:26:44.687Z",
    "implementation": {
      "evaluation_supervisor": "701886edea19f6a402c06112f211899a487b66fdd6893aab11f508caf6dc1a32",
      "gemini_transport.py": "5c0137c055c4dbf3be20b59affe0018fa28290dbbb6fe4d615751638a269886b",
      "gemma_evaluation": "d827c03fcdf998e9fd6fe5177d322fb1b58867634ccd9756e86a21296583a417",
      "run_gemini_trial.py": "e93c9d7213404889bac5604588c060e8950de5a281a0fdeafc1ebed2daee836d"
    },
    "inputs_sha256": "00bfb7bd04b3f369426e4db8c6d78d69926ef659bf8072d114369c1415d42516",
    "model_id": "gemma-4-26b-a4b-it",
    "preparation_sha256": "c68839b5cd915b870e6020e689426cef4eb5fa279b9abe735f6a8624d4d4bf0b",
    "probes": [
      {
        "dimensions": {
          "height_px": 700,
          "width_px": 700
        },
        "image_id": "img-000001",
        "path": "images/img-000001.png",
        "sha256": "3257bc74718d4bdab6f397dc176ec2886893b4a49970f032eefa74a9e647ee48"
      },
      {
        "dimensions": {
          "height_px": 700,
          "width_px": 700
        },
        "image_id": "img-000002",
        "path": "images/img-000002.png",
        "sha256": "6d64d28d9d4586e490938f7c0a59502345234db887b20dbee6a8fb1b9bdfa303"
      },
      {
        "dimensions": {
          "height_px": 700,
          "width_px": 700
        },
        "image_id": "img-000003",
        "path": "images/img-000003.png",
        "sha256": "039e7147c280cfc9ea40dee186e5ec3d754dd6950763673ef15388328d850a18"
      },
      {
        "dimensions": {
          "height_px": 700,
          "width_px": 700
        },
        "image_id": "img-000004",
        "path": "images/img-000004.png",
        "sha256": "57938af871c90ab39b64115a12841a27169b1f43a95c744a9f3e0a0ad46050e4"
      },
      {
        "dimensions": {
          "height_px": 700,
          "width_px": 700
        },
        "image_id": "img-000005",
        "path": "images/img-000005.png",
        "sha256": "db82d3dc7f950c444a778a69c51ab3408a06f515cabb6df51b85052973ab9f71"
      },
      {
        "dimensions": {
          "height_px": 700,
          "width_px": 700
        },
        "image_id": "img-000006",
        "path": "images/img-000006.png",
        "sha256": "c9e67058f4fb58cc36cef59d550a160662f429ad69ae21b36e84f3419a26dbb6"
      },
      {
        "dimensions": {
          "height_px": 700,
          "width_px": 700
        },
        "image_id": "img-000007",
        "path": "images/img-000007.png",
        "sha256": "b260fe56ea657ca4a9c7c09a8d609babdaeaeaace8a26c79daca08a938593d7f"
      },
      {
        "dimensions": {
          "height_px": 700,
          "width_px": 700
        },
        "image_id": "img-000008",
        "path": "images/img-000008.png",
        "sha256": "1c8bea8e2fbfcd66edb6db61f79f330192342ef7c5f0ce303751e59c6b82dde4"
      },
      {
        "dimensions": {
          "height_px": 700,
          "width_px": 700
        },
        "image_id": "img-000009",
        "path": "images/img-000009.png",
        "sha256": "b4b887c214b895a2f6313e07571fff123811b8cdd041fae82eef678de2a92885"
      },
      {
        "dimensions": {
          "height_px": 700,
          "width_px": 700
        },
        "image_id": "img-000010",
        "path": "images/img-000010.png",
        "sha256": "591cc5833d06237bb698caa4e3ab800bb31e442f58b958a8f2725a20a581442f"
      },
      {
        "dimensions": {
          "height_px": 700,
          "width_px": 700
        },
        "image_id": "img-000011",
        "path": "images/img-000011.png",
        "sha256": "df34dc79077e5dc377f1f33fee55c3484355918dd9c345a9a7f739016106d0af"
      },
      {
        "dimensions": {
          "height_px": 700,
          "width_px": 700
        },
        "image_id": "img-000012",
        "path": "images/img-000012.png",
        "sha256": "74d2e1ada9ec20f356dd5017eebf5053496b0bd1c83a0c407bf23c4b10c15524"
      },
      {
        "dimensions": {
          "height_px": 700,
          "width_px": 700
        },
        "image_id": "img-000013",
        "path": "images/img-000013.png",
        "sha256": "ca8c7740837f9fb505660d9b1dee54c0924e580c5285f346eee7e90e997cd0c1"
      },
      {
        "dimensions": {
          "height_px": 700,
          "width_px": 700
        },
        "image_id": "img-000014",
        "path": "images/img-000014.png",
        "sha256": "276ab29c029c34bd1743ab1c3a0d4d86d6aea86caa7ad1acda5e119cadaa6dd6"
      },
      {
        "dimensions": {
          "height_px": 700,
          "width_px": 700
        },
        "image_id": "img-000015",
        "path": "images/img-000015.png",
        "sha256": "2b893107762ffab6e03b3b36920051a54a4665b73ae4447315d95dfe8843cec2"
      },
      {
        "dimensions": {
          "height_px": 700,
          "width_px": 700
        },
        "image_id": "img-000016",
        "path": "images/img-000016.png",
        "sha256": "1f5134733e65b9e431562fb8ca61786bc848df46eafbb0f835a48dd70876346d"
      },
      {
        "dimensions": {
          "height_px": 700,
          "width_px": 700
        },
        "image_id": "img-000017",
        "path": "images/img-000017.png",
        "sha256": "7d19ba13a6f89692416afb7a92a68df05ced405c0ff6e48a46343733266d7be2"
      },
      {
        "dimensions": {
          "height_px": 700,
          "width_px": 700
        },
        "image_id": "img-000018",
        "path": "images/img-000018.png",
        "sha256": "3c609d13b4f4c740a9b9d22fcc6e75cfc4094d0a435156a31f06fb2bf80e1af0"
      },
      {
        "dimensions": {
          "height_px": 700,
          "width_px": 700
        },
        "image_id": "img-000019",
        "path": "images/img-000019.png",
        "sha256": "d8e6c957c71d0c996c46f2028195a22f55fa49395d6a58c2f2aa021784dae0a8"
      },
      {
        "dimensions": {
          "height_px": 700,
          "width_px": 700
        },
        "image_id": "img-000020",
        "path": "images/img-000020.png",
        "sha256": "124fa0c37e86d420fd54e4fb544d7fad3face258f4e8a7db7e0a0d1e790315b9"
      },
      {
        "dimensions": {
          "height_px": 700,
          "width_px": 700
        },
        "image_id": "img-000021",
        "path": "images/img-000021.png",
        "sha256": "4bd8ba9f96315b1a9350665a911cbffb2b4659e523d7e76ba2bcfb588ab476ca"
      },
      {
        "dimensions": {
          "height_px": 700,
          "width_px": 700
        },
        "image_id": "img-000022",
        "path": "images/img-000022.png",
        "sha256": "88b78187872f499ada3113d779ab06cb686bf8d2f69d1a9401d72b0bfe958822"
      },
      {
        "dimensions": {
          "height_px": 700,
          "width_px": 700
        },
        "image_id": "img-000023",
        "path": "images/img-000023.png",
        "sha256": "dad9e66d87289017f7c3934e45983cdb5bebb82f7345c8d3a2e3e50ad5890e65"
      },
      {
        "dimensions": {
          "height_px": 700,
          "width_px": 700
        },
        "image_id": "img-000024",
        "path": "images/img-000024.png",
        "sha256": "17697efd77a8c390a9c3f1229a187e80f92ee342aa692bd927f015494598ced2"
      },
      {
        "dimensions": {
          "height_px": 700,
          "width_px": 700
        },
        "image_id": "img-000025",
        "path": "images/img-000025.png",
        "sha256": "05a706b2996e5de444ac768bf02cb1a8d476655cc20c362590eb73bcae94fa8b"
      },
      {
        "dimensions": {
          "height_px": 700,
          "width_px": 700
        },
        "image_id": "img-000026",
        "path": "images/img-000026.png",
        "sha256": "ff7b71ebf88ac0d2fbde42970dd74e72d0956f9be4a5036df041a003dc1cdb84"
      },
      {
        "dimensions": {
          "height_px": 700,
          "width_px": 700
        },
        "image_id": "img-000027",
        "path": "images/img-000027.png",
        "sha256": "5abe3a150c5a4a20a7c146c81ed8efc5fef3895ba1e1a0f5377e32da6c37e0b7"
      },
      {
        "dimensions": {
          "height_px": 700,
          "width_px": 700
        },
        "image_id": "img-000028",
        "path": "images/img-000028.png",